{
  "schema": "bench-site/1.0",
  "batch": "b1",
  "generated_at": "2026-09-03T20:51:34Z",
  "suite": {
    "id": "plan-composition",
    "title": "Co-Evolution Plan Benchmark",
    "summary": "Four plan-composition conditions run on identical planning tasks, scored by three blind automated judges in position-swapped pairwise trials.",
    "primary_judge": "fable",
    "preregistration": "benchmarks/PREREGISTRATION.md",
    "report": "benchmarks/reports/b1.md",
    "judges": [
      {
        "id": "fable",
        "model": "claude-fable-5",
        "cli_version": "2.1.200 (Claude Code)",
        "effort": "high",
        "model_assert": "configured-only"
      },
      {
        "id": "codex",
        "model": "gpt-5.5",
        "cli_version": "codex-cli 0.144.5",
        "effort": "xhigh",
        "model_assert": "verified"
      },
      {
        "id": "glm",
        "model": "glm-5.3-flash",
        "cli_version": "curl 8.11.0 (x86_64-w64-mingw32) libcurl/8.11.0 Schannel zlib/1.3.1 brotli/1.1.0 zstd/1.5.6 libidn2/2.3.7 libpsl/0.21.5 libssh2/1.11.1",
        "effort": "",
        "model_assert": "configured-only"
      }
    ]
  },
  "metric": {
    "id": "win_rate",
    "label": "Win rate",
    "axis_label": "Win rate (%)",
    "unit": "percent",
    "min": 0,
    "max": 100,
    "parity": 50,
    "higher_is_better": true,
    "per_judge": true,
    "rubric": "Pairwise blind A/B judging — the standard rubric for this suite. Every condition meets every other condition on every task, twice per judge with the document order swapped. A win scores 1; a tie or a position-biased pair scores 0.5 to each side (PREREGISTRATION.md section 4); pairs dropped by sanitization or invalid evidence leave both the numerator and the denominator. 50% is parity with the rest of the field, and 100% means the condition won every comparison it was scored on.",
    "note": "Reported separately for each judge and never adjudicated into a single score."
  },
  "cost": {
    "label": "Captured cost (floor)",
    "axis_label": "Captured cost (floor), USD",
    "unit": "usd",
    "note": "Sums every total_cost_usd in each cell's tokens sidecar. Claude reports that field; the direct GLM and Kimi sidecars report tokens without a price, and Codex has no sidecar. The number is therefore a floor, not a total. Judging cost is not included — the judge CLIs run without token capture."
  },
  "completeness": {
    "tasks": 8,
    "task_ids": [
      "t1",
      "t2",
      "t3",
      "t4",
      "t5",
      "t6",
      "t7",
      "t8"
    ],
    "conditions": 4,
    "condition_ids": [
      "A",
      "B",
      "C",
      "D"
    ],
    "judges_requested": [
      "fable",
      "codex",
      "glm"
    ],
    "judges_with_verdicts": [
      "fable",
      "codex",
      "glm"
    ],
    "expected_pairs_per_judge": 48,
    "generation_cells_complete": true,
    "incomplete_cells": [],
    "degraded_cells": [],
    "excluded_documents": [
      {
        "task": "t2",
        "condition": "A",
        "why": "sanitize-leak"
      },
      {
        "task": "t2",
        "condition": "D",
        "why": "sanitize-leak"
      },
      {
        "task": "t6",
        "condition": "D",
        "why": "sanitize-leak"
      }
    ],
    "per_judge": [
      {
        "judge": "fable",
        "verdict_files": 48,
        "expected_pairs": 48,
        "unjudged": 0
      },
      {
        "judge": "codex",
        "verdict_files": 48,
        "expected_pairs": 48,
        "unjudged": 0
      },
      {
        "judge": "glm",
        "verdict_files": 48,
        "expected_pairs": 48,
        "unjudged": 0
      }
    ],
    "note": "Expected pairs assumes every condition survives sanitization and no cell is degraded. A nonzero unjudged count means every rate on this page is computed over what exists, not over what was planned."
  },
  "conditions": [
    {
      "id": "A",
      "label": "solo",
      "kind": "solo",
      "glm_calls_per_run": 0,
      "seats": [
        "composer"
      ],
      "models": [
        "claude-fable-5"
      ],
      "description": "Single invoke_claude call on the fable-5 seat, using the byte-identical compose prompt the bouncer builds (co-evolve-bouncer.sh:785-787). No second pass, no critique, no revision.",
      "cells": 8,
      "mean_words": 636,
      "mean_wall_secs": 39,
      "converged": 0,
      "adjudicated": 0,
      "stuck": 0,
      "glm_calls": 0,
      "captured_cost_usd": 5.5873,
      "per_judge": {
        "fable": {
          "wins": 2,
          "comparisons": 20,
          "score": 10,
          "bt_strength": 0.0034,
          "decisive_wins": 1,
          "decisive_losses": 17,
          "ties": 0,
          "position_biased": 2,
          "excluded": 4,
          "missing": 0,
          "vs": {
            "B": {
              "wins": 2,
              "n": 7,
              "rate": 28.57
            },
            "C": {
              "wins": 0,
              "n": 7,
              "rate": 0
            },
            "D": {
              "wins": 0,
              "n": 6,
              "rate": 0
            }
          }
        },
        "codex": {
          "wins": 2,
          "comparisons": 20,
          "score": 10,
          "bt_strength": 0.0031,
          "decisive_wins": 2,
          "decisive_losses": 18,
          "ties": 0,
          "position_biased": 0,
          "excluded": 4,
          "missing": 0,
          "vs": {
            "B": {
              "wins": 0,
              "n": 7,
              "rate": 0
            },
            "C": {
              "wins": 0,
              "n": 7,
              "rate": 0
            },
            "D": {
              "wins": 2,
              "n": 6,
              "rate": 33.33
            }
          }
        },
        "glm": {
          "wins": 1.5,
          "comparisons": 20,
          "score": 7.5,
          "bt_strength": 0.0040,
          "decisive_wins": 0,
          "decisive_losses": 17,
          "ties": 0,
          "position_biased": 3,
          "excluded": 4,
          "missing": 0,
          "vs": {
            "B": {
              "wins": 1,
              "n": 7,
              "rate": 14.29
            },
            "C": {
              "wins": 0,
              "n": 7,
              "rate": 0
            },
            "D": {
              "wins": 0.5,
              "n": 6,
              "rate": 8.33
            }
          }
        }
      }
    },
    {
      "id": "B",
      "label": "codex-bounce",
      "kind": "bouncer",
      "glm_calls_per_run": 0,
      "seats": [
        "claude",
        "codex"
      ],
      "models": [
        "claude-fable-5",
        "codex CLI default"
      ],
      "description": "Cross-vendor bounce: Fable composes, Codex critiques and revises. Final document is Codex-revised (co-evolve-bouncer.sh seat semantics, odd passes review / even passes compose). Primary treatment under test.",
      "cells": 8,
      "mean_words": 671,
      "mean_wall_secs": 209,
      "converged": 8,
      "adjudicated": 0,
      "stuck": 0,
      "glm_calls": 0,
      "captured_cost_usd": 9.6163,
      "per_judge": {
        "fable": {
          "wins": 6,
          "comparisons": 21,
          "score": 28.57,
          "bt_strength": 0.0104,
          "decisive_wins": 5,
          "decisive_losses": 14,
          "ties": 0,
          "position_biased": 2,
          "excluded": 3,
          "missing": 0,
          "vs": {
            "A": {
              "wins": 5,
              "n": 7,
              "rate": 71.43
            },
            "C": {
              "wins": 0,
              "n": 8,
              "rate": 0
            },
            "D": {
              "wins": 1,
              "n": 6,
              "rate": 16.67
            }
          }
        },
        "codex": {
          "wins": 12,
          "comparisons": 21,
          "score": 57.14,
          "bt_strength": 0.0547,
          "decisive_wins": 12,
          "decisive_losses": 9,
          "ties": 0,
          "position_biased": 0,
          "excluded": 3,
          "missing": 0,
          "vs": {
            "A": {
              "wins": 7,
              "n": 7,
              "rate": 100
            },
            "C": {
              "wins": 0,
              "n": 8,
              "rate": 0
            },
            "D": {
              "wins": 5,
              "n": 6,
              "rate": 83.33
            }
          }
        },
        "glm": {
          "wins": 8.5,
          "comparisons": 21,
          "score": 40.48,
          "bt_strength": 0.0260,
          "decisive_wins": 7,
          "decisive_losses": 11,
          "ties": 0,
          "position_biased": 3,
          "excluded": 3,
          "missing": 0,
          "vs": {
            "A": {
              "wins": 6,
              "n": 7,
              "rate": 85.71
            },
            "C": {
              "wins": 0,
              "n": 8,
              "rate": 0
            },
            "D": {
              "wins": 2.5,
              "n": 6,
              "rate": 41.67
            }
          }
        }
      }
    },
    {
      "id": "C",
      "label": "panel",
      "kind": "panel",
      "glm_calls_per_run": 1,
      "seats": [
        "composer",
        "codex",
        "glm",
        "kimi"
      ],
      "models": [
        "claude-fable-5",
        "codex CLI default",
        "glm-5.3-flash",
        "kimi-k3"
      ],
      "description": "Fable composes; codex, glm, and kimi each critique independently with no rewrite access; Fable synthesizes a final revision accepting or rejecting each critique point on its merits. Exploratory condition.",
      "cells": 8,
      "mean_words": 656,
      "mean_wall_secs": 655,
      "converged": 0,
      "adjudicated": 0,
      "stuck": 0,
      "glm_calls": 8,
      "captured_cost_usd": 12.6194,
      "per_judge": {
        "fable": {
          "wins": 21,
          "comparisons": 21,
          "score": 100,